CleanTweets,label
nomor resi mohon bantu tidak bisa pakai jne saja reguler tidak bisa lacak,negatif
nomor resi nya estimasi sendiri nya april sampai paket belum sampai antar pagi eh malam ya balik gudang besok siang status antar malam balik lagi gudang begitu ya sampai kesal,negatif
nomor resi paket belum terima cek resi sudah kirim buat kecewa deh sicepat,negatif
nomor resi sudah terima nama teman tidak kenal tidak hubung mohon,negatif
nomor resi tanggal september henti nomor resi tanggal september henti administrator mau komplain whatsapp whatsapp anteraja rusak nomor resi tidak sah,negatif
nomor resi ya sampai estimasi akhir hari lama sekali kirim tidak sesuai estimasi janji,negatif
nomor tolong kasih nasib langgan sudah kejar tanya shopee express lempar tolong sudah hari terima kasih,negatif
nomor ya biar tidak tanya lagi tolong janji kirim barang langgan hari loh jangan buat usaha ganggu,negatif
normal paket kemarin belum kirim jne beban,negatif
nya sicepat lambat,negatif
oalah paket bawa sicepat banget,negatif
oh begitu ya bodoh tidak sicepat ya jnt pertama anteraja aneh banget gagal melulu,negatif
oke begitu tidak boikot tidak pakai jasa jne saja teman,negatif
oke besok kirim paket pantang pakai lagi anti aroma kadal,negatif
oke bisa kirim cepat bisa kirim aman lain guna sicepat barang sampai hancur pecah tolong pesan langsung ya,negatif
oke kak tolong cepat ambil ya sudah tunggu hari loh paket sudah kemarin status barang not,negatif
oke terima kasih respons tolong tingkat lagi kerja jaga laden situs baru akhir cek paket tidak gerak sekali,negatif
oke tidak mau pakai lagi begitu jnt lebih bagus cepat,negatif
omong kosong jam hubung tidak balas jam niat tidak sih layan langgan,negatif
omong omong barang antar pakai kurir sudah minggu lebih status antar kurir rumah sampai tidak sampai pesan barang kota tidak kota telepon layan langgan tidak bisa whatsapp respons tidak jelas,negatif
omong omong buat kirim paket berat kg saran jangan pakai jne deh barang jelek sekali,negatif
omong omong paket mana ya sudah hari belum sampai,negatif
ongkos sicepat nya kg sistem shopee salah cantum shopee hutang sicepat potong dana hm bisa bisa,negatif
orang stres cinta stres jne astaga,negatif
padu mantap rugi langgan,negatif
pagi administrator lanjut paket sudah kirim detail pesan langsung kemarin belum respons kemarin sudah aju keluh email whatsapp tidak tanggap,negatif
pagi kak mohon informasi nya resi status nya tunda kirim ya kirim tidak konfirmasi jne tolong jelas ya kak barang mau pakai segera terima kasih,negatif
pagi komplain tidak tingkat lagi bicara orang tidak dengar sia tidak hilang simpan paket gudang hari bangsat sekali ekspedisi lain komplain begitu minimal gerak paket,negatif
pagi pagi kesal jne ingat paket pakai lama sekali sampai aduh tempat pakai jnt reguler hari sudah sampai tempat kirim lebih jauh,negatif
pagi pikir paket sudah macet hari anteraja cimahi,negatif
pakai ekspedisi anteraja mesti masalah sial melulu sudah dulu pertama kali pakai anteraja kirim rumah orang jauh sudah tunggu tarik oper jakarta utara jakarta timur tidak jelas banget jakarta surabaya hari,negatif
pakai ekspedisi belah hari sudah sampai sudah tanggung jawab,negatif
pakai ekspedisi nasib baca paragraf kalimat hibur omong kosong situs nya rasa mual ekspedisi lain hari sampai sudah hari awal tidak estimasi tera aplikasi,negatif
pakai ekspedisi sicepat halu memang ya minggu lebih barang tidak sampai kirim surabaya surabaya langsung mampir jakarta dulu mentok situ tanggal agustus tidak mana lagi hai halo,negatif
pakai jasa sicepat sampai barang tabung poster tengah bisa bolong begitu bahan lumayan keras tabung karton begitu,negatif
pakai jne gara gara satu pagi beban lama eh saja lama,negatif
pakai jne mesti lambat sekali,negatif
pakai jne percaya nama besar balas kecewa tolong hak ku sendiri pakai jne bayar lebih biar paket hari sampai hari jelas hari paket ku nyata hilang,negatif
pakai jne saja bang jnt memang kecewa pegawai banyak tidak jelas,negatif
pakai jne sih tidak layak saja pakai jne tidak sih,negatif
pakai jnt lambat sih ganti jne saja,negatif
pakai jnt saja sicepat sekali tidak rekomendasi notifikasi posisi barang pakai sicepat tidak gerak,negatif
pakai kurir lain saja percaya sudah banyak rugi jne banyak kurir lambat mau ganti kurir,negatif
pakai ninja express memang jelek layan barang lambat sampai minggu kesal,negatif
pakai paket baik sampai tanggal sampai belum sampai ya,negatif
pakai sampai hari kesal sekali tidak kaya sicepat mana dengar kabar paket teman hilang hancur sudah,negatif
pakai shopee express hari jawa kalimantan hari memang hubung transit begitu kemarin baru sampai pas email nya kapok,negatif
pakai shopee express lama sekali ganti jnt tidak jne sudah periksa pesan waktu mau ganti eh toko tidak pilih shopee express,negatif
pakai shopee express standar sekali ya tunggu sampai coba pakai jnt pasti lama hari,negatif
pakai sicepat barang sesat kota belah mana barang mahal lagi,negatif
pakai sicepat halu lama sekali tidak jalan,negatif
pakai sicepat jakarta utara jakarta selatan hari,negatif
pakai sicepat kirim pakai si lambat,negatif
pakai sicepat lama lewat tanggal estimasi,negatif
pakai sicepat lambat,negatif
pakai sicepat lambat sekali ya hari doang jakarta status sudah hari,negatif
pakai sicepat status gagal ambil sudah belanja toko beda mau salah toko,negatif
pakai sicepat tidak sampai,negatif
paket administrator sampai tidak kirim kirim hari hari bayar paket,negatif
paket ajak keliling dunia dulu kah,negatif
paket ambil sampai paket sesat sicepat memang mantap banget deh,negatif
paket antar lokasi pagi sampai jam belum sampai jalan kaki,negatif
paket anteraja ambil pagi sampai ons proses,negatif
paket belum sampai kembali lagi sudah sampai labuh ratu tinggal rumah lagi balik lagi,negatif
paket belum sampai notifikasi tidak jalan kemarin bisa tolong cek,negatif
paket belum sampai pakai jne kirim tanggal april hari tanggal sudah sampai ya nomor resi,negatif
paket belum sampai tidak becus,negatif
paket belum sampai ya sudah hari lewat batas estimasi status paket bolak balik gudang sortir jakarta timur jakarta barat administrator paket hilang kadang kadang tidak jelas,negatif
paket belum terima status sudah selesai,negatif
paket datang buka ya memang sop ekspedisi intip paket sudah kali paket datang kemas rusak,negatif
paket datang kondisi belah bekas buka pakai kondisi acak an tidak bungkus gelembung rapi pesan proteksi produk kecewa sekali bisa nya paket langgan layan not si not profesional,negatif
paket hai kirim lambat sekali asli tanggal sangkut,negatif
paket hari saja tidak sampai mending tidak usah buka buka sicepat halu sudah cepat halu,negatif
paket hari tahan gudang anteraja tidak bisa ambil butuh banget,negatif
paket hari tidak sampai kurir jalan jongkok,negatif
paket hilang sampai tidak jelas ping payah banget layan sengaja waktu ujung paket hilang hilang,negatif
paket hilang temu kondisi rusak bela curi paket konsumen korban sistem kirim tidak solusi proses lambat rugi konsumen,negatif
paket hilang tertawa lawak banget anteraja tertawa paket harga anjing bangsat memang anteraja ekspedisi buruk bayar tempat bayar tidak modal banget tidak mau bayar anjing memang pakai hilang paket,negatif
paket hilang tidak usah sudah,negatif
paket ibu benang sudah begitu pesan lain pakai sicepat rapi,negatif
paket isi tanam belum jalan status paket lain kota sudah sampai,negatif
paket jakarta lebih baik kota sendiri paket penting butuh jne tidak peduli paket tidak kirim sudah kota tuju sudah hari paket sudah kota tuju,negatif
paket jakarta timur pakai hari tidak sampai sampai,negatif
paket kabar bantu cek tidak sih hari jumat tidak jalan,negatif
paket kakak rusak astaga tidak lagi sudah pakai jne,negatif
paket kamis tidak ubah status parah sih,negatif
paket kesasar,negatif
paket kirim hilang sudah sekian lama tunggu bagus,negatif
paket kirim jne ya sudah begitu sicepat tidak tanggung jawab lagi suruh koordinasi jne situ kirim suruh wira mana paket tidak sampai lagi,negatif
paket kirim kota yogyakarta lama banget ya tanggal siang tidak maju maju,negatif
paket kirim lewat jne akhir hilang lebih minggu tidak antar alam jne jelek sekali email tidak hubung whatsapp tidak balas telepon tidak angkat terlalu mau,negatif
paket kirim tanggal sampai hari tidak sampai proses investigasi klaim ongkos kirim harga barang kirim tidak mohon balas twit pesan langsung jam tidak respons kirim somasi,negatif
paket ku belum sampai sudah sampai baru boikot jne ya,negatif
paket ku henti situ tanggal sampai tidak malu administrator,negatif
paket lama ya si pakai ekspedisi sicepat biar cepat cepat ekspedisi belah tolong resi paket kirim bal,negatif
paket langgan hilang ganti kali lipat harga emosi banget sudah minggu lempar ya anjing,negatif
paket lanjut tanggal tidak gerak sampai lanjut kacau,negatif
paket lebih senang surabaya ya bolak balik surabaya melulu sering banget pakai anteraja putar putar melulu,negatif
paket lewat pas sampai paket rusak buka sampai robek sampai kardus pakai barang sampai lapis sampai barang,negatif
paket macet lagi paket anteraja tidak sampai beda paket sicepat hari langsung datang,negatif
paket macet si sudah dekat rumah sudah kontak layan langgan panggil whatsapp maksimal sampai hari posisi sabtu pagi sampai mau ambil saja bisa tidak ya,negatif
paket macet sudah minggu,negatif
paket macet surabaya sudah hari sicepat,negatif
paket mana sih sampai belum sampai jne nya situ baca keluarga tidak paket sampai,negatif
paket nasib administrator ya allah,negatif
paket nomor resi jakarta bandung tanggal juni belum datang kemarin telepon panggil janji barang datang tanggal juni hari sudah coba telepon langgan layan jne pagi malam tidak bisa sambung email tidak bisa,negatif
paket nomor resi macet tanggal ya sudah lewat estimasi sampai belum sampai sampai,negatif
paket nomor resi sudah minggu paket belum terima status kirim tidak ganti ons ya tumben lama sampai barang jakarta tidak sampai minggu nama terima nama jne reguler,negatif
paket nya lama banget sih nama saja sicepat nyata nya lambat ganti nama saja,negatif
paket nya mana tidak respons,negatif
paket pagi status jalan beli sampai belum sampai ya,negatif
paket proses taruh begitu saja sih,negatif
paket register nomor resi alamat tuju malang kirim tanggal mei sampai belum terima lama sekali,negatif
paket register resi jakarta tuju kirim tanggal sep sampai sudah hari tidak gerak status,negatif
paket resi belum antar ya sudah mau minggu,negatif
paket resi jp hai kalah layan lambat kurang puas,negatif
paket resi tidak maju maju ya tanggal,negatif
paket rusak buka kemas paket taruh depan rumah konfirmasi mohon bantu nya,negatif
paket rusak jual tidak bungkus baik pas panggil edukasi beli salah beli tidak pakai asuransi jne tidak tanggung jawab banyak alas kurir jne tidak salah,negatif
paket senin tidak sampai jakarta administrator lama sekali terang jakarta cerita,negatif
paket sicepat tidak cepat,negatif
paket sicepat tidak jalan sekali,negatif
paket sicepat tidak sampai rumah ya sudah sampai tempat sortir hari mana paket lagi,negatif
paket status sudah terima belum terima sudah tanggal maret mana paket hai,negatif
paket sudah hari hubung jakarta timur lama banget sampai,negatif
paket sudah hari tidak sampai suruh tunggu lagi maksimal hari ya barang sudah bal total bisa minggu jne mantap besok tidak rekomendasi pakai jne sudah kapok,negatif
paket sudah kirim tanggal agustus belum sampai akhir terima jakarta selatan tanggal september tidak lagi ya lanjut,negatif
paket sudah lebih minggu belum sampai paket lebih sampai lebih dulu jne mana kira paket mohon tanggap,negatif
paket sudah minggu kirim tidak sampai sampai sudah telepon layan langgan tidak angkat whatsapp balas robot tidak jelas antar saja tidak mau pakai antar saja lagi,negatif
paket sudah minggu tidak datang pesan langsung tidak balas memang jne buat emosi,negatif
paket sudah minggu tidak sampai,negatif
paket sudah minggu tidak sampai pakai kurir lain sudah sampai hari pakai anteraja macet cimahi paket minggu tidak sekali minggu macet tempat,negatif
paket sudah sampai balik madiun lagi cerita buruk saja jne,negatif
paket sudah sampai mana hai jangan bilang cek pesan ya bosan,negatif
paket sudah surabaya hari sabtu tidak antar tempat paket jakarta hari langsung kirim alamat tidak kirim,negatif
paket sudah tangerang mana hari tidak baru status paket hilang tolong informasi nya paket sudah sampai mana biar ambil sendiri,negatif
paket surat muat udara tolong jual peduli saran ya kurir bebas ongkos kirim konsumen bisa pilih mau pakai kurir pakai anteraja ya akhir masalah melulu,negatif
paket tanggal april belum sampai tolong kurir baik lagi,negatif
paket tanggal april sampai mei belum sampai henti tanggal mei sudah sampai kota,negatif
paket tanggal januari sampai tidak gerak ya batam saja administrator jne saja loh paket pakai jnt pos lancar saja,negatif
paket tanggal juni belum sampai macet mohon segera kirim nomor resi,negatif
paket tanggal kirim kurir tunggu sampai belum sampai,negatif
paket tanggal situ saja ya sih kirim barang wilayah jakarta sampai minggu lebih ya sicepat doang,negatif
paket tanggal status tidak ubah jakarta utara melulu administrator tidak respons,negatif
paket tanggal sudah si bogor tidak kirim kirim astaga rumah tunggu mau pakai pakai estimasi lain pagi sampai siang sudah jalan antar rumah sesal sekali pilih kira pendek,negatif
paket tidak gerak status situ situ saja tolong banget mah hai astaga,negatif
paket tidak jarak ambil sendiri layan hubung layan langgan nomor respons pola ekspedisi model ya,negatif
paket tidak kirim,negatif
paket tidak kirim ya sudah hari mentok jne depok tidak gerak nomor,negatif
paket tidak sampai hilang tel bumi dasar jne,negatif
paket tidak sampai lacak tinggal kota kirim batam sudah kota tuju surabaya parah,negatif
paket tidak sampai sesal jual lewat dapat si peduli,negatif
paket tidak sampai sih,negatif
paket tidak sampai sudah kirim tanggal sampai payah,negatif
paket tidak sampai sudah lebih estimasi waktu melulu barang surabaya loh bisa lebih sabun muka sudah hari sabun muka,negatif
paket tidak sampai ya bang,negatif
paket timbun ganti nama saja,negatif
paket tuju makassar sesat,negatif
paket tulis hubung barat gudang tidak,negatif
panggil tidak aktif hari nomor tidak mau cak paket kirim tidak bisa,negatif
pantau kurir tidak saja sicepat lagi sih paket jnt sudah sampai,negatif
parah banget antar saja tanggal belum sampai sampai pakai lanjut parah si tidak mau pakai lagi,negatif
parah banget kirim keluh pesan langsung twitter whatsapp tidak respons,negatif
parah banget memang sicepat,negatif
parah benar banget sudah tidak pakai jne tertawa,negatif
parah hari minggu tulis tidak baru kirim,negatif
parah ih kurir sudah tahu alamat tidak jelas hubung kirim tidak tahu gagal ambil sudah hubung layan langgan biar catat eh tidak kecewa deh not depan pakai,negatif
parah jakarta bekas hari belum sampai bekas bekas lagi hari tidak sampai sampai,negatif
parah jne pusat saja tidak tahu kantor cabang libur tidak hari tidak khawatir barang,negatif
parah mana coba sudah tidak tahu lagi jne memang tidak bisa sanggup kirim lebih baik batas langgan,negatif
parah nya jne akhir kali pakai buruk selamat tinggal sih,negatif
parah paket belum sampai sudah minggu pakai sicepat anjing,negatif
parah sekali kakak,negatif
parah sekali lambat sicepat halu paket mei sampai mei belum sampai rumah,negatif
parah sih anteraja sampai hari paket macet cimahi tanggal,negatif
parah sudah paket sangkut tanggal tanya jual dasar lapor sicepat paket hilang sudah,negatif
parah suruh pesan langsung tidak respons,negatif
parah tukang anteraja,negatif
parah wilayah brebes jawa kurir lambat parah sistem jne sudah lebih baik pakai pos saja cepat,negatif
pas belanja pakai sicepat besok sudah sampai gilir jual pakai sicepat lama banget sampai,negatif
pas buka paket kirim elektronik kemas basah kuyup kotor susah payah akhir temu nama kirim sudah luntur kacau jnt pakai kurir begitu lebih baik jne mana mahal main lama tahu etika,negatif
payah ah jne status paket tidak baru kurir nya tidak kreatif buat whatsapp terima tidak,negatif
payah memang sicepat bawa jakarta barat barat selatan putar dulu timur kawan,negatif
peduli anteraja memang sering salah alamat sudah paket sesat tetangga,negatif
peduli barang belum sampai status baru transaksi tokopedia sudah saja paket teman tidak pakai water sicepat sendiri lambat respons,negatif
peduli heran tidak sesuai nama lagi kirim mohon ulang alam jelek layan,negatif
peduli kak pakai paket hari saja tidak sampai barang saran moga peduli henti kerja,negatif
peduli segera lebih hati laku barang ekspedisi mitra utama sicepat layan,negatif
pegawai makan uang haram ya colong paket tertawa,negatif
persis alam lacak nomor resi tidak gerak tidak konfirmasi komplain baru deh paket nyata hilang,negatif
pertama akhir kirim paket mandiri pakai kirim lama komplain pertama komplain instagram instagram hapus,negatif
pertama kali kecewa sicepat tumben banget kirim sampai minggu bandung hari sudah lama eh minggu makan basi,negatif
pertama kali pakai jasa sudah pesan langsung sudah whatsapp balas bot pusing mau komplain aplikasi tidak sudi mau masuk ktp ya sudah kecewa banget saja terima kasih ya bantu pertama akhir sekian selamat malam,negatif
pertama kali terima album pakai jne ujung anjing kesal sekali sampul doang,negatif
pertama kali urus jasa ekspedisi ninja express tidak langsung urus terima paket sampai paket belum terima kirim kirim hari kamis kemarin pakai layan kecewa nya tidak bagus,negatif
pesan barang ekspedisi jne kemarin bawa kurir jam wib pssi rumah tidak eh jam wib status kirim hari barang bawa kurir jam wib sampai sudah jam tidak sampai gudang jne tidak begitu jauh posisi,negatif
pesan barang kirim gosend ganti grab express cepat pesan tanggal sampai barang belum sampai sopir gosend grab batal jemput tidak pakai gosend grab pesan peduli,negatif
pesan barang kirim pakai jne tanggal agustus sampai agustus belum sampai ons lain tidak laku libur nomor resi,negatif
pesan barang shopee pakai gosend tidak bisa kasih nilai ya abang nya nya sudah abang nya benar sebal parah tolong,negatif
pesan jakarta saja belum kirim pakai jne pasti lama,negatif
pesan jakarta timur camat hari sampai macet,negatif
pesan langsung diam siang suruh tunggu mau pindah cabang lain sudah lagi saja status,negatif
pesan langsung tidak balas balas,negatif
pesan langsung tidak respons respons najis sekali sudah,negatif
pesan lanjut hari rabu sudah sampai jumat tidak sampai bangkai mana dokumen pesan lanjut biar sampai cepat gawat tidak sampai bangkrut saja tidak sih anteraja kesal banget,negatif
pesan macet jakarta sudah hari serius jne jangan kecewa langgan,negatif
pesan nya belum ubah terang nya ya kemarin kemas saja,negatif
pesan tanggal butuh buat pesan besok sampai tidak sampai sampai,negatif
pesan tokopedia sudah kirim jne tanggal juni sudah minggu paket belum sampai sudah pesan langsung tidak balas telepon tidak angkat lampir detail status kirim mohon proses,negatif
pikir area kota tinggal cek lini endap paket banyak kota lihat saja keluh kesah langgan sicepat tukar peduli,negatif
pokok kesal level anteraja jnt sicepat paket sudah sampai kemarin,negatif
pokok tidak lagi deh pakai ekspedisi rugi waktu rugi pulsa lapor tidak bilang proses maaf doang tidak solusi sekali gilir mau ambil sendiri tidak bisa,negatif
posisi belum sampai administrator jam,negatif
promo bebas ongkos kirim kurir memang lambat sekali ya,negatif
pt global jet express jnt express pt sicepat indonesia ekspedisi nakal curi barang konsumen petisi,negatif
pulsa doang layan langgan saja paket tidak sampai sampai sih jne buruk,negatif
pusing banget jne,negatif
pusing sudah kemarin beli barang sudah pakai gosend instan tidak kirim sampai aduh buat besok pagi,negatif
putar komidi putar jelek paket nya mau pakai nya cepat molor,negatif
ragu jne,negatif
ragu sudah jne anjing ya,negatif
ramai lepas masalah memang jne susul kakak kandung si tik ekspedisi jalan tempat promo jne pelit berapa tahun jangan heran jnt sicepat ninja express bisa maju pesat jne,negatif
rencana beli jakarta twitter seram kak lanjut pakai jne emas kayu dapat bungkus gelembung doang,negatif
resi aneh sih kirim bogor bogor lewat jakarta buat lama saja tolong baru sistem kirim nya kota saja pakai kirim jakarta dulu,negatif
resi at jakarta jam pagi layan loh jne tidak profesional,negatif
resi batam tanggal belum sampai ya tolong antar segera tuju terima kasih,negatif
resi jne kirim kemarin belum sampai ya nya yakin esok sampai,negatif
resi nomor barang tidak sampai rumah status nya tidak bisa lacak sekali jne lambat,negatif
resi nomor jne tidak jalan kota kemarin hari sampai buat pakai akhir proses lama sekali register,negatif
resi paket proses melulu tangerang surabaya hari ekspedisi nama sudah besar layan heran pas maka jne,negatif
resi status sudah terima terima bilang belum terima mohon,negatif
resi tanggal macet hubung jakarta sampai tidak baru,negatif
respons tidak jawab masalah balas pesan langsung kelas jne amatir tugas belum kirim paket hubung paket baru bisa kirim hari status kirim jne tulis barang sudah kirim jangan kacau,negatif
ribet nya mau kirim paket pakai tik,negatif
rugi barang sudah rusak jne kes jne lari tanggung jawab ulur waktu alas tidak masuk akal jne ekspedisi sudah besar pasti sudah tahu,negatif
rumah tidak nama datang sicepat dekat layan buruk hadap langgan baik jangan putar dangdut tidak suruh duduk aduh ampun deh,negatif
sabar abang ekspedisi memang kacau masalah komplain nomor resi bantu tim resolusi tidak begitu saja,negatif
sabar sekali jne dajal,negatif
sabtu abang terlalu banget jne,negatif
sadis kurir jne paket rusak solusi jawab barang orang laku,negatif
saja astaga gantung kurir saja pakai sicepat barang hilang tertawa abar lewat whatsapp suruh bawa saja balik tidak tempat eh besok hilang,negatif
saja barang hancur ulang kurir simpang siur rugi bisa bisa mau kirim barang beli mau kirim beling,negatif
saja begitu sampai kesal asli sampai telepon balik jne baru paket sampai hari telepon pagi baru respons magrib tidak erti sudah tindak lanjut mana layan langgan nya,negatif
saja kecewa layan sicepat,negatif
saja kirim nya lambat lebih baik sicepat orang jnt,negatif
saja komplain sudah bulan tidak selesai memang tidak niat ganti rugi bilang terang jangan banyak basa basi,negatif
saja layan tidak enak jne banyak,negatif
saja memang sudah tidak bisa andal mau cepat lebih baik jne deh,negatif
saja memang tingkah kurir jne lapor pusat sudah hubung langgan tidak asa hubung bodoh,negatif
saja sampai hari proses tidak sudah lapor sicepat tidak sudah masalah belit begitu doang tidak becus,negatif
saja sudah lama tidak aktif ekspedisi tidak jelas tahu baik sampai kantor pusat tidak bisa hubung daerah pegawai banyak keluar tidak jelas hierarki usaha paket jual tidak urus bobrok parah,negatif
saja tidak enak sekali jujur paket tidak ambil nya sudah lama sampai langgan tanya jasa kirim ku pakai saja saja,negatif
salah alas tidak pakai jne maaf jnt lebih baik,negatif
salah sekali memang pilih jne buat kirim beli shopee lama sekali,negatif
salam administrator lacak paket tokopedia nomor tagih sicepat belum baru situs sicepat paket sudah sampai tanggal mohon terima kasih,negatif
sampai banyuwangi saja belum probolinggo,negatif
sampai belum sampai jne loh tahi,negatif
sampai cek kantor tidak layan langgan nya suruh tunggu cek kira jam abang kurir datang bawa barang status shopee sudah terima,negatif
sampai hari belum datang gila banget pesan negeri pesan lebih lambat si halu sudah sampai lebih dulu,negatif
sampai kakak kantor depan nya bingung akhir paket rusak rapi,negatif
sampai memang begitu bolak balik melulu anjing sicepat tidak jelas,negatif
sampai nya basa banget jne ujung batal terima tolak alamat tidak,negatif
sampai paket belum kirim kirim,negatif
sampai paket belum terima besok sabtu minggu libur bisa terima hari senin butuh isi paket tolong sanksi kurir bogor kota kecil butuh jam antar paket saja,negatif
sampai paket macet sat set,negatif
sampai paket titip jaya raya tidak sampai pos satu aman depan tidak mau lagi pakai anteraja,negatif
sampai sampai barang minggu tidak sampai mana barang besar sekali kg hilang barang kecil wajar jne memang begitu kg telepon layan langgan bilang cek cek facebook instagram tidak respons layan buruk mau telepon tidak aktif nomor mau tanya alamat,negatif
sampai tidak sampai paket sudah hari pakai baik paket kirim pakai kurir belah reguler lebih dulu sampai kapok,negatif
sampai tidak sampai sampai paket parah banget,negatif
sampai tidak ubah jne barang timbun,negatif
saran lebih baik ganti nama saja lambat status kirim belum antar langsung kembali tukang malas sortir kurir malas antar kacau peduli,negatif
sebal banget barang tidak gerak gerak tanggal minimal masuk kabupaten dulu alamat tidak lengkap beli daring tidak jadi paket macet provinsi sudah komplain tidak maju sial sekali pakai jne,negatif
sebal ekspedisi anteraja paket lama sampai,negatif
sedih banget orang bangga pakai sicepat,negatif
sedih pakai sicepat kemarin tahu memang cepat banget,negatif
sedih sekali belum sampai pakai sudah hari tahu begitu lebih baik bayar regular saja ongkos tidak beda,negatif
sedih sih zaman ekspedisi kirim tidak jujur sampai orang tidak percaya lagi pakai ekspedisi kirim bisa bisa kena batu usaha gulung tikar loh tolong cek sampai akar akar sanksi,negatif
segera baik sistem deh rugi jual konsumen parah pesan sudah sampai gudang hari macet tidak antar malam datang barang karung tidak bisa buka kurir status hilang,negatif
sekali loh astaga anteraja lambat,negatif
sekali pakai jne ya ya,negatif
sekali pakai terima kasih loh ya layan buruk coba contoh ekspedisi lain tidak paket sampai simpan nomor kurir,negatif
sekian lama tidak pakai jne hari paket kurir lagi lagi warung depan rumah rumah telepon tidak angkat ring doang biasa jelek titip titip paket orang nomor resi,negatif
