CleanTweets,label
halo kak nomor resi henti ya sudah hari tunggu telepon layan langgan tidak,negatif
halo kak paket sudah minggu lebih tidak sampai sudah provinsi belum kota sudah komplain mana mana whatsapp instagram twitter pesan langsung tidak respons sih layan nya,negatif
halo kak paket tanggal tahan hubung jakarta timur ya paket paket kirim lambat sekali pantau aplikasi tidak gerak tanggal,negatif
halo kak ya perihal paket nomor resi pesan kirim tanggal september sampai jakarta tolong jangan begitu berapa kali sudah pakai jasa sicepat tidak cepat,negatif
halo kakak jne ya paket adik minggu tidak ubah sekali ons proses tidak tahu sampai mana paket pesan resi tidak temu kemarin telepon jne sibuk sampai pulsa habis,negatif
halo kamis macet jakarta utara tidak gerak kemarin sabar jangan buat kecewa,negatif
halo maaf ya pagi sudah kesal jne palangkaraya alamat tidak lengkap ya tinggal bilang enak bisa tolong bisa tindak lanjut ya terima kasih,negatif
halo macet sih tolong butuh banget barang,negatif
halo mau keluh pesan resi pesan tanggal belum terima status akhir malam sudah terima tidak kurir minggu datang tolong profesionalitas data kurir saja tidak,negatif
halo mau tanya administrator paket nomor resi tidak jalan ya,negatif
halo mau tanya paket kota malang kepanjen dekat sampai ya nomor surat muat udara,negatif
halo mau tanya paket sudah dar kemarin sampai pusat drop sampai hari belum kirim ya,negatif
halo pakai sicepat halu lama sekali sudah mau hari tidak jalan,negatif
halo paket antar kota salah status tukar mohon alamat sudah jelas antar kota lain layan,negatif
halo paket belum antar rumah estimasi ubah ubah akhir sudah tanggal,negatif
halo paket belum sampai terima terang sudah terima sangkut ya tolong,negatif
halo paket belum terima status sudah si pakai tulis terima lagi orang rumah tidak nama nomor resi tolong cek,negatif
halo paket diam hari sudah sampai kota tuju cabang lumajang ya kak mohon bantu paket kira habis hari,negatif
halo paket macet tanggal ya sudah mau pulang paket belum sampai,negatif
halo paket sudah hari hubung saja,negatif
halo paket tanggal belum sampai barusan cek status paket hilang sudah aju kembali dana sih gemas ya bisa bisa paket hilang status akhir sudah jalan lokasi,negatif
halo paket tanggal mei sampai batas waktu tentu sicepat juni macet tidak tahu paket temu tidak hubung komplain whatsapp hari tidak balas administrator resi,negatif
halo pesan grab express rusak ya riwayat tidak sudah kurang belum sopir sudah menit lebih terima kasih,negatif
halo resi estimasi sampai berapa hari ya lacak sudah hari belum gerak normal terima kasih,negatif
halo resi sudah lebih estimasi hari tidak gerak lama sekali,negatif
halo si layan nya parah sekali status barang tanggal jakarta utara sampai tanggal mau antar alamat memang mau begitu saja barang situ tolong sudah hari tidak keluar situ,negatif
halo susah sekali hubung jne ya,negatif
halo tanggung jawab paket hilang agen maaf gratis ongkos kirim alah ribu doang,negatif
halo teman pakai ekspedisi anteraja tidak memang lama tidak si,negatif
halo terima nomor resi sicepat regular mohon informasi status siang tukar telepon panggil putus,negatif
halo ya kali pesan lambat sampai sampai belum datang,negatif
halo ya paket belum gerak lagi hari rabu hitung sudah hari paket belum sampai,negatif
hapus pilih kirim logo spanduk,negatif
hari lihat twit negatif jne,negatif
hari minggu paket tidak gerak ya sudah libur,negatif
hari paket tidak gerak kirim tanggal jakarta depok sampai tanggal belum sampai pakai jne loh,negatif
hari sampai memang ekspedisi lebih lambat sicepat sih,negatif
hari tanggal pesan paket ekspedisi beda saja tidak sampai kota,negatif
hari tidak gerak hubung tim aduh tidur kali ya orang,negatif
hari tidak tanggap tanggung jawab tidak sekali,negatif
hati hati pakai ya pantau takut sesat barang,negatif
hati kakak barang begitu pesan sudah jalan gagal suruh tunggu eh nya lagi rusak parah kakak nya kakak,negatif
hati kasihan usaha sudah injak tahun tidak bijak situasi bisa kabur langgan,negatif
hati pakai jne aneh paket jakarta tidak boleh ambil paket selagi belum keluar kota mau ambil tidak boleh saran saja hati pakai jne,negatif
hati pokok jne biang kerok sekali,negatif
hebat sekali ya tidak kurir datang eh baru status kurir sicepat bohong status,negatif
henti layan jijik,negatif
heran nya tidak sampai jnt sicepat sudah sampai loh,negatif
heran pakai jasa ekspedisi kargo pasti lewat tanggal sampai barang kali kecewa jasa kirim tidak paham lagi nama saja sicepat sampai lama,negatif
hilang jne mau aju komplain jual nya pakai asuransi bisa kembali dana tidak asuransi ya ongkos kirim,negatif
hilang uang tidak masalah tanggung jawab sudah percaya tidak amanah,negatif
hindar pakai lion lagi murah sih murah lambat lebih internet tahun,negatif
hubung jawab pola banget parah sekali layan,negatif
hubung paket sudah lewat tanggal estimasi komplain anteraja kacau hancur banget sistem paket sudah hilang beli jual rugi,negatif
hubung whatsapp nya suruh tunggu sampai hari tidak jawab layan langgan,negatif
ibu beli barang pakai jne tahu tidak sudah sobek,negatif
ibu ibu susu kerja kirim asi nya rumah kirim pakai gosend eh sopir minum anjing mau korea indonesia saja,negatif
ibu paket jne sudah minggu lebih tidak datang anjing memang ibu si tidak misuh isi paket harga buat anjing,negatif
id express bagus tidak murah banget takut sebentar si ninja murah lama banget sampai,negatif
id express shopee express sicepat tidak tahu jnt lama,negatif
idexpress memang suka macet sih lelah sekali,negatif
idul adha kali baru sampai barang belum lagi takut hancur sebentar blokir sicepat pilih kirim si,negatif
ih alam waktu pesan sistem bayar tempat kak kerja balas whatsapp oke memang salah habis kirim ulang eh sampai hari tidak sampai hubung,negatif
ih astaga buat emosi saja sicepat,negatif
ih cepat loh lanjut pesan ganti sicepat kirim jnt lama,negatif
ih deh sudah hari sudah buat lapor tidak jelas masak buat surat lapor sih,negatif
ih hari akhir hari sampai tidak tahu alamat beda tulis pesan hubung panggil tidak guna,negatif
ih kapok sekali pakai sicepat,negatif
ih kurir tukang colong memang ekspedisi sampah,negatif
ih malas sekali semenjak tidak bisa pilih ekspedisi shopee sekali sicepat sudah sekali abang indra,negatif
ih nomor jne kirim poster,negatif
ih parah sekali kemarin kirim gagal melulu orang rumah tidak sampai sampai sebentar tidak orang rumah sudah whatsapp nomor sicepat nomor respons pending lagi gilir rumah kosong lelah pilih sicepat tepat waktu,negatif
ih saja sih pagi paket sesat rumah orang masalah tidak tahu mana anteraja layan langgan nya tidak bisa telepon sumpah kesal sekali paket sudah tunggu lama banget,negatif
ih sudah malas pakai jasa ambil jne sudah benar memang saja sendiri,negatif
ih sumpah ya tidak tanggung jawab sekali paket lanjut sudah hari macet situ saja,negatif
ih untung sobek tidak pas nya sicepat anjing baru kali terima paket sobek,negatif
informasi jne memang sering kasus beli toko daring tidak jasa jnt sicepat serah deh pokok jangan jne,negatif
informasi paket sudah antar kurir administrator pagi sampai belum sampai,negatif
ingat alam buruk beli barang pakai layan jne barang tidak datang sampai lebih hari telepon nomor kurir tugas area rumah tidak sampai hari marah barang datang kondisi kotak habis buka kesal banget,negatif
internal nya parah henti sudah jne jnt kantor pos,negatif
investigasi berapa lama omong doang sampai tidak jelas,negatif
iphone hilang jne jne sudah datang rumah buat maaf sampai besok senin barang tidak sampai langsung bisa aju asuransi juta ya sudah drama rugi waktu moga saja pas klaim asuransi tidak buat ribet cepat,negatif
istigfar nasib paket sangkut jangan rencana orang deh,negatif
jakarta barat jakarta selatan lewat tangerang dulu sudah hari tidak sampai sampai benar benar tobat pakai,negatif
jakarta sampai minggu tidak sampai barang,negatif
jakarta selatan hari belum sampai barang tumpuk jakarta tidak kirim tidak penuh gudang kasihan paket makan,negatif
jakarta selatan sicepat lama,negatif
jakarta timur jakarta selatan loh administrator sungguh ku lelah,negatif
jangan buat takut kirim paket lama lama beli album luring,negatif
jangan dulu maaf paket macet tidak antar kurir sudah hari payah,negatif
jangan kirim paket pakai resi depok yogyakarta sesat sesat surabaya suruh tunggu hari tunggu hari tahu sesat sampai suruh tunggu minggu benar kecewa,negatif
jangan lagi deh pilih anteraja,negatif
jangan pakai anteraja tolong kesal masak barang antar desa belah mentang nama main taruh saja tidak hubung dulu begitu untung baik hubung bilang paket sesat,negatif
jangan pakai jnt sicepat lambat tidak tolong,negatif
jangan pakai sicepat dulu parah sekali tidak kirim paket dulu,negatif
jangan pakai sicepat kak ekspedisi busuk,negatif
jangan pakai sicepat kak tidak sampai,negatif
jangan pakai sicepat ya,negatif
jangan pola robot masalah cepat selesai hak paket lengkap kirim tengah tidak selesai nama tipu rugi langgan sudah berapa lama,negatif
jasa ekspedisi sicepat sudah tidak cepat dulu ya,negatif
jasa kirim tidak rekomendasi kenal jelek jatuh sudah hubung layan langgan suruh tunggu sampai tanggal badut,negatif
jatuh merek dulu cinta layan sicepat lengkap gerai rajin kurir lama kurang ya kualitas mohon fokus kembali layan top dulu,negatif
jauh paket sih obat hai,negatif
jawa barat jawa serasa kalimantan jawa alias lama banget sicepat lambat,negatif
jawab hilang barang sudah minggu lebih tidak jelas sekali bisa barang kotak besar berat kg bisa hilang begitu saja logis deh,negatif
jawab pesan langsung hai paket tidak sampai gila banget,negatif
jelas jne makan saja hilang barang kpop,negatif
jelek banget kirim sering tunda mondar mandir paket macet jakarta utara kemarin,negatif
jelek belanja salah pusat belanja jual sudah ambil tanggal jam sampai detik belum sudah jam antar,negatif
jelek sekali layan sistem,negatif
jelek sekali tidak becus,negatif
jengkel sekali,negatif
jengkel ya posisi solo lempar cirebon kirim semarang paket hari minggu ekspedisi baru jangan kalah lama baik kualitas kirim,negatif
jne antar barang lama sekali tidak jalan status kirim surabaya malang saja tanggal sampai status tolong baik sistem kirim,negatif
jne anteraja ekspedisi jelek,negatif
jne baik pakai jnt antar pulau sudah paket pos saja mahal ya lambat ya,negatif
jne bau tidak mau pakai jne lagi maaf banget,negatif
jne bayi larang buka coba dempet barang berat bisa hilang bentuk lipat setrika,negatif
jne bobrok barang pakai jnt sicepat aman aman saja sekali pakai jne buat kirim giling mi sampai tempat rusak,negatif
jne bobrok parah,negatif
jne buruk super buruk baru kali benar kapok pakai jne,negatif
jne express ganti nama deh buru tidak lihat jasa kirim barang sampai bang,negatif
jne gagal astaga asli lebih baik sicepat reguler burak,negatif
jne gila sudah kirim kota bisa,negatif
jne hari buat kesal jne cabang harap baru sudah jam tidak jne kali baru rusak payah,negatif
jne hilang batik kakak laki laki tindak lanjut tidak tanggung jawab,negatif
jne jakarta pusat depok memang butuh hari ya jakarta depok beda pulau ya kirim paket,negatif
jne jelek banget paket tidak jalan jalan sudah kirim tanggal saja,negatif
jne kacau,negatif
jne kacau sekali ya pusing,negatif
jne kait kasus kasus lain kait jne tidak tambah bising politik polisi usut,negatif
jne kak id express macet kurir hari lama sekali,negatif
jne kapok sudah antar saja sudah lama kadang macet hilang,negatif
jne kenal mahal ya lambat sekali,negatif
jne kirim barang hari rumah tidak enak sekali langgan tumben jelek sekali,negatif
jne kirim barang lama sekali sudah,negatif
jne komplain paket sampai tidak kirim terima nama panji nomor alamat kp rt desa bogor nomor resi cek sudah molor hari tertawa,negatif
jne kopok lambat,negatif
jne kurir nya galak sekali,negatif
jne lagi lambat banget ya paket hari sudah sampai kota tuju sampai belum antar,negatif
jne lama parah kadang barang sampai rusak tidak bisa lacak,negatif
jne lama sekali anjing paket macet melulu tidak kirim sudah hari,negatif
jne lama sekali deh kesal,negatif
jne lama sekali pakai jakarta tidak mau kirim china jakarta hari tanggal jam an sudah sampai jakarta tanggal tidak bisa kirim,negatif
jne lama tidak jnt jauh sekali beda pesan barang beda hari hari sabtu sudah sampai hari minggu jne sampai belum sampai sampai sampai saja tidak baru tolong baru,negatif
jne lambat ganti ekspedisi saja sudah kapok pakai,negatif
jne lambat sekali,negatif
jne lambat sekali ya,negatif
jne lambat sekali ya allah,negatif
jne lambat ya dulu jne murah cepat sampai kalah cepat jnt sicepat ekspedisi baru lain murah,negatif
jne layan langgan tidak bisa telepon ya email belum balas tolong cek pesan langsung administrator paket macet surabaya tanggal tidak surabaya malang hari sampai,negatif
jne lebih banyak kakak sering sekali barang rusak hilang basah pokok deh sicepat bisa kakak,negatif
jne libur kali ya barang tidak kirim kirim,negatif
jne lucu ya barang cek resi nya sudah sampai terima datang barang tidak,negatif
jne mah buat emosi melulu selamat tinggal sicepat memang cepat sudah molor minggu lebih baru sampai mana paket tidak jelas mana layan langgan nya susah,negatif
jne malu sicepat cepat kirim paket hari pasti sampai kerja jne kecewa jne lebih senior sicepat niat kerja tidak sih,negatif
jne masak salah kirim ulang,negatif
jne mau tanya operasional pakai tangan besi dos tebal sekali bisa robek lampir simpan waktu kirim besok buat ya,negatif
jne memang bangsat raja tega rusak tidak rusak sampai tuju paham,negatif
jne memang jelek sekali,negatif
jne memang kesal,negatif
jne memang lagi kacau parah kirim paket bandung sampai minggu,negatif
jne memang lama sih lagi banyak kirim paket pasti tidak tahu sih coba saja tunggu hari hari lagi,negatif
jne memang sebal sekali sih paket ku bolak balik status ku sudah terima status balik bawa kurir tidak komplain tidak tindak lanjut kurir nya tidak hubung nomor nya,negatif
jne memang suka macet begitu tidak sih,negatif
jne mohon cek kirim kirim tanggal mei tanggal sudah terima hari belum terima nomor resi terima bp sukma hati,negatif
jne paket belum sampai sudah kurir jam sampai jam belum sampai,negatif
jne paket hilang bulan baru temu ekspedisi lagi kacau paket saja sesat,negatif
jne parah banget kirim bisa hari loh tolong baik,negatif
jne parah hai paket sudah minggu tidak sampai hari jakarta melulu,negatif
jne peduli benar tidak peduli konsumen aneh paket bisa ambil orang kantor jne tulis kirim tolong jne tindak lanjut tunggu lambat sekali proses kecewa,negatif
jne proses lama banget reguler hari estimasi jari tidak ekspedisi belah tutup tidak lama,negatif
jne putar ya takut kemarin pas cek resi tulis rumah kantor kosong toko ramai banyak orang,negatif
jne seram,negatif
jne serius lama lama tidak pakai jne lagi loh deh sistem sudah parah banget kali,negatif
jne sesat sampai roma,negatif
jne shopee buat gondok,negatif
jne si anjing sekali,negatif
jne sih mahal lambat sendiri tertawa,negatif
jne sudah yakin esok sampai tahi nyata hari,negatif
jne tahi sekali,negatif
jne tidak jelas anjing,negatif
jne tidak jelas memang paket terima nama ibu tidak,negatif
jne tindak kurir tidak kece barang rusak tidak baru tahu jne perhati kondisi kirim jelek ya kualitas tertawa,negatif
jne tolong layan buruk banget,negatif
jne total juara barang hilang barang rusak barang tukar barang tidak sampai sampai sudah alam,negatif
jne usaha bodoh sulit pakai,negatif
jne ya komunikasi kurir langgan buruk kes canda tidak orang selo hari tunggu jelas banyak sengaja luang waktu,negatif
jne ya paket sesat melulu ya sudah komplain telepon layan langgan sebentar sesat memang sih belah boleh ya lebih teliti sudah jelas sekian keluh kesah terima kasih,negatif
jne ya seram lihat orang jelek mana basah rusak jne memang kadang rugi waktu harga materi rasa,negatif
jne ya tidak pertanggungjawabannya paket sudah sampai pas cek resi tidak gerak gerak jakarta saja,negatif
jne zaman dulu sudah lebih parah pindah sicepat jnt mana kurir galak lagi salah,negatif
jnt daftar ku hindar sekali hari sudah sampai paket sudah jual sampai tidak sampai pilih jnt lebih cepat gagal kecewa deh jnt express,negatif
jnt express lagi sudah ya kirim barang lumayan lama,negatif
jnt express layan lambat nak hari macet sudah dekat drop daerah pos laju lambat,negatif
jnt express paket belum datang,negatif
jnt express sudah busuk benar jangan ulah ya bilang status paket sudah terima sore tidak terima,negatif
jnt express tidak jelas sekali tidak mau pilih ekspedisi,negatif
jnt hari barang penyok sicepat minggu plus barang sudah penyok,negatif
jnt jakarta hari sicepat hari doang hari belum sampai paket kemas jual nya tidak si tidak sabar saja mau terima paket,negatif
jnt jne sudah malas sicepat,negatif
jnt jne tidak kurir,negatif
jnt kemarin buat pakai sicepat,negatif
jnt lama sekali sudah lambat hari astaga memang tidak ya emosi makassar saja sudah hari sicepat beli jepit hari sudah sampai jakarta makassar dekat,negatif
jnt lambat ya bisa bisa bekas bandung hari belum sampai,negatif
jnt lambat ya sudah benar sicepat deh ya mentok mentok anteraja,negatif
jnt lumayan kadang suka masalah jne amit amit deh malas pakai,negatif
jnt macet ya jakarta denpasar tanggal tidak sampai sampai sicepat hari sudah denpasar tolong jangan elah,negatif
jnt mahal sendiri sih mana potong harga sudah potong lebih mahal pakai jne balik jne saja,negatif
jnt masalah ambil sering buat emosi beda id express sicepat,negatif
jnt memang lambat mau express tidak beda barang minggu tidak sampai sampai bangsat,negatif
jnt memang suka masalah banget sih malas pakai ekspedisi pas beli tablet samsung harga juta an kurir jnt tidak mau kirim rumah eh kurir id express untung kurir id express amanah tidak memang jnt,negatif
jnt parah banget status aplikasi ons kirim kurir tidak jalan mesti dulu pas cek kurir duduk saja sampai hari bisa besok sore baru antar alamat,negatif
jnt sicepat nama saja cepat asli lambat habis,negatif
jnt sicepat si jne lama anteraja lama sekali ninja id suka sesat tidak tahu tempat suka ku malas gerak telepon telepon begitu tik tidak mau pakai lagi trauma paket hilang untung ganti ribet sisa tidak pakai,negatif
jnt sicepat sudah kapok pakai jne,negatif
jnt tumben banget kalah cepat sicepat tahu begitu pilih sicepat saja mana makan gampang basi sudah tahu makan gampang basi sampai jam pagi sampai belum kirim rumah,negatif
jorok ya kurir baru coba pakai jne rekomendasi bagus tidak bayang,negatif
jual kali rugi layan ambil notifikasi gagal ambil tidak manusia datang paket putar tidak jelas jengkel hapus jasa daftar jasa kirim bisnis makan hari ah saja,negatif
jujur kesal sicepat hari paket tidak ambil,negatif
jujur sekali sebal ekspedisi nya pakai lion lama banget sumpah pakai sicepat tidak bisa pilih,negatif
jujur sicepat benar cepat jakarta moga harga regular tokopedia gratis hari terang notifikasi ambil orang lain tulis nama kakak,negatif
juragan lagi tunggu paket provinsi sudah jempol loh kirim kudus bandung bisa kurang jam bandung sampai hari gila kali ya sicepat bandung turun profesionalitas,negatif
juta juta juta juta isi paket susu bubuk persen penyok susu tumpah paket sudah pasang stiker rapuh laku karyawan jne,negatif
kacau alam nya baik buruk,negatif
kacau banget sicepat antar jakarta sudah hari belum sampai,negatif
kacau sekali,negatif
kacau si sudah ganggu orang buka paket tampa izin,negatif
kacau sicepat sudah berani begitu bogor sudah kasus begitu tidak sih mesti ganti jasa kirim sih mah,negatif
kadang sicepat tidak cepat,negatif
kah jnt macet paket paket sicepat sudah datang hari periksa pesan nya,negatif
kak anteraja memang masalah paket hilang kak,negatif
kak barang tidak gerak gerak sudah lebih minggu,negatif
kak informasi sudah bawa kurir sampai tidak sampai sampai ya,negatif
kak jakarta bandung sampai minggu basi tidak uang langgan tidak makan sebal,negatif
kak maaf tanggal tidak gerak sekali tunda kirim belum sekali informasi loh barang kirim tidak resi,negatif
kak mohon informasi paket tanggal pesan belum jalan pindah,negatif
kak paket belum ya dekat sudah hari tidak sampai,negatif
kak sa kemarin mata pakai jnt eh pakai jne lupa ganti mana sampai lama,negatif
kak sudah nyata hilang,negatif
kak tanggal diam cimahi kirim ya kak,negatif
kak tolong informasi paket resi belum antar belum baru lagi sudah sampai agen jne lokasi malam,negatif
kak tolong paket macet jakarta saja ya tanggal belum tanda berangkat mau tuju nomor resi,negatif
kak tolong paket tidak sampai sudah lempar jne pusat jne muara bulian jne teman paket hilang rusak an ganti rugi,negatif
kak tolong segera antar alamat terima pagi belum gerak lagi,negatif
kak tolong teman kasihan sekali kak jne nya lambat sekali ya,negatif
kak waktu beli sudah penyok sampai pas jalan begitu paket banting begitu ya omong omong pakai ekspedisi sicepat kak,negatif
kakak bantu nomor resi jne jne tidak ubah paket sudah sampai beli minggu gawat kasus batal sistem shopee terima kasih,negatif
kakak kirim paket pakai jne resi nomor kirim sabtu jam set siang jam pagi paket tidak jalan ya gudang jakarta dok penting dosen sampai hari,negatif
kakak mau camil camil kripik kilo bisa ecer bisa mau bisa harga nya rasa pedas manis terima kirim indonesia jne pos ayo pesan bisa hubung sendiri kakak,negatif
kakak paket sudah sampai belum banget kakak paket ku macet gudang sortir,negatif
kakak paket sudah tangerang tanggal jne tidak paket ekspedisi lain sudah datang pagi kirim,negatif
kakak sudah tidak lagi pakai jne layan hari kecewa barang berkas mesti rusak pas sampai,negatif
kali jne ekspedisi tidak aman anteraja hilang jne hilang iphone sekian juta bau saing bisnis ekspedisi,negatif
kali kirim barang paket sudah ambil kurir hilang besok datang cari lagi paket,negatif
kali nun paket sudah sampai tahun memang jne nya tidak tidak tahu paket sesat mana mana pulau teh,negatif
kali pakai anteraja lama sekali takut paket ku kirim waktu lumayan lama kota transit hari,negatif
kali pakai sicepat paket macet tempat konfirmasi sicepat baru paket jalan lagi jujur habis kecewa jarang pakai sicepat lebih baik pilih jnt memang mahal,negatif
kali pesan ambil shopee tidak datang ambil ya hari pesan tahu deh datang tidak kurir nya,negatif
kali pesan pakai bebas ongkos kirim layan anteraja buruk tunggu paket antar tidak jelas status jalan mana kurir buana,negatif
kali sesal pakai sicepat nyata tidak cepat sampai paket tidak sampai akhir ya pakai sicepat,negatif
kapok astaga tidak mau pakai sicepat,negatif
kapok deh,negatif
kapok kirim barang pakai grabexpress tahi abang,negatif
kapok lambat,negatif
kapok memang jne tertawa rumah kosong tertawa,negatif
kapok pakai jasa sudah kirim tanggal tangerang sampai tidak kirim status tangerang layan langgan tidak bantu kemarin telepon jne tangerang sampai hari tidak baru,negatif
kapok pakai jne sudah minggu belum datang paket,negatif
kapok pakai jnt kapok pakai jne sicepat suka tahan barang kantor beda daerah beda layan sih,negatif
kapok pakai kirim kota saja sampai hari belum sampai tanya langgan layan jawab ulang robot akhir pakai jasa kurir,negatif
kapok sicepat,negatif
kapok sih pakai anteraja sampai minggu baru datang paket,negatif
kapok sih pakai ekspedisi tidak lagi deh,negatif
kapok sumpah pakai ekspedisi sicepat halu benar halu,negatif
kardus saja bisa hilang tidak tanggung jawab,negatif
kasar sih sedih ah,negatif
kasih saja bintang nilai jelek hati hati saja sih nilai besok nya pesan alamat gosend sampai banyak begitu,negatif
kasihan karyawan jne laku bos jne buat emosi,negatif
kasihan tahu tidak jual sudah percaya hancur begitu saja jne memang sih waktu beli album pakai jne benar muka kurir kesal paket pas pakai jnt astaga semerbak sekali,negatif
kasus sampai belum selesai sudah minggu jalan status sudah kirim tidak terima bukti terima tidak,negatif
kecewa banget barang tunda hari tidak tahu sampai bogor jakarta pusat tanya kurir lempar barang mau kirim lagi,negatif
kecewa banget ekspedisi mau klaim ganti rugi paket hilang saja susah sekali,negatif
kecewa banget layan nya lihat resi nya paket sudah sampai agen tanggal april sampai paket tidak alamat sudah tunggu tidak paket rumah layan pesan langsung instagram tidak balas,negatif
kecewa beri informasi kurang sah layan langgan telepon email resi akhir datang awal resi awal belum datang sampai informasi email maksimal kirim hari informasi layan langgan telepon maksimal hari buset benar mana,negatif
kecewa bisa nya tidak amanah paket langgan tolak komplain tuntut hak sendiri tolong tuntut hak hilang kemas paket rusak,negatif
kecewa lagi lagi paket kondisi kondisi paket bolong mana nya tidak curiga sih peduli,negatif
kecewa layan jne barang sudah sampai kemarin sampai hari belum kirim kurir kak kurir hubung tidak jawab,negatif
kecewa layan nomor resi semarang semarang jarak tidak lebih antar lebih hari beli email tidak respons,negatif
kecewa loh pakai layan si indonesia alih pakai saja saja saja murah tidak jamin cepat sampai paket kilat khusus express naik burak,negatif
kecewa pakai anteraja sudah tunggu lama paket hilang kerja bisa hilang tidak tanggung jawab paket,negatif
kecewa sekali sih pakai sicepat barang hilang tidak tanggung nomor layan langgan jawab tindak lanjut doang langsung ganti produk ganti kirim buat rugi orang saja tidak tanggung jawab,negatif
kecewa sicepat jnt jne jne lama si,negatif
kecewa tingkat dewa hai beli barang jual kota bisa salah alamat sortir hari sampai loh pakai tetangga belah eh sesat gunung kidul tanggap,negatif
kecewa ya sas,negatif
keluh banyak paket hilang ya uang kembali dana nya jangan lupa ya hari tanya nomor rekening tanya resi lain lain memang situ balas lagi tidak tolong layan lebih baik,negatif
kemarin ambil sendiri gudang jne banyak sekali belum antar pas lacak tidak gerak,negatif
kemarin balas akun sicepat biar respons respons begitu saja tidak buat lega tahu tidak balas sopan marah sendiri,negatif
