CleanTweets,label
kemarin banyak kasus paket hilang pakai anteraja banyak nominal besar hilang kemarin teman album hilang album ya co shopee bilang maaf bukti data lain lain tidak respons,negatif
kemarin habis beli produk kirim anteraja barang kirim orang lain status tulis terima terima asli,negatif
kemarin kak adu shopee saja biar bisa kembali dana sicepat memang tidak kembang paket hilang,negatif
kemarin kena astagfirullah jne masalah hidup hai semangat kakak moga bisa cepat ganti ya,negatif
kemarin mau pilih jne harga lebih mahal,negatif
kemarin pakai jne dekat rumah tahu jne lebih baik pindah saja jnt ayo sicepat saja deh jne tidak pakai deh,negatif
kemarin pakai jne toko tidak kurir lain alhasil tanggal juli sampai barang tidak sampai sudah lelah buat lapor maaf suruh tunggu informasi barang hilang barang besar kg memang kocak,negatif
kemarin pesan langsung tidak respons mau tunggu sampai lagi paket tidak gerak mau tunggu minggu lagi kemarin mau kirim segera paket cek pesan langsung,negatif
kemarin saja tidak selesai memang anjing malas banget,negatif
kemarin status paket terima sampai belum sampai,negatif
kemarin teman pakai sicepat masalah,negatif
kemarin tidak gerak gerak sudah sampai situ paket hari pasti datang loh,negatif
keren banget ekspedisi sudah minggu tidak kembang barang lanjut ya administrator prestasi mu,negatif
kerja minggu pesan barang antar jakarta,negatif
kerja sicepat sb harap kabar baik begitu banyak kabar buruk paket hilang,negatif
kesal banget ah jne salah salah besar pilih,negatif
kesal banget anteraja paket sudah tidak jual tidak,negatif
kesal banget idexpress tidak bisa astaga mau ambil sendiri saja paket,negatif
kesal ninja benar benar tidak express sekali sudah minggu pesan tidak sampai sampai,negatif
kesal sekali astaga niat biar barang cepat sampai barang macet jakarta sudah hari tanggal september estimasi lambat hari september tanya langgan peduli suruh tunggu melulu sampai,negatif
kesal sekali jne allahuakbar,negatif
kesal sekali jne buka lapak balas lama orang begitu ganggu sekali toko daring badan komentar instagram,negatif
kesal sekali jne tidak jalan hari,negatif
kesal sopir tunggu sudah menit buat sopir ambil saja mau gosend buku sekolah orang lihat tidak sih sudah gojek orang tempat lain kesal,negatif
kilas ekspedisi mayoritas lambat jual sudah ambil lebih jam tidak tidak lagi sudah pakai ekspedisi,negatif
kira kira sampai paket ya mana tunggu banget benar benar kecewa,negatif
kirim administrator surah buat ambil gagal,negatif
kirim akhir koordinator bantu kurir daerah rumah tim lambat sekali waktu hari tidak,negatif
kirim anteraja tidak tahu tahu bilang tidak hubung main langsung paket saja sudah kirim lambat kali hari ih geram,negatif
kirim barang nya lama respons nya lambat sekali,negatif
kirim barang salah terima kurir nya sih situ jelas nomor terima nama terima tidak telepon konsumen terima nya alamat terima jelas sah tolong cek ya salah terima nya sudah,negatif
kirim barang surabaya bekas pakai jne trucking kirim barang sampai konsumen jne tidak mau ganti rugi ulur waktu alhasil paket tidak mau pakai jne lagi,negatif
kirim belum sampai bisa maaf sekali lagi jne benar benar buruk moga langgan bijak pilih jasa kirim jne tidak saran,negatif
kirim jakarta lama hari sudah hari belum sampai lacak terus lambat sekali gerak,negatif
kirim jne tanggal sampai belum sampai kerja jne resi juta estimasi sampai tanggal kemarin mobil mogok kelas jne begitu loh tidak antar antar,negatif
kirim kemarin kirim gratis ongkos kirim sicepat anteraja kirim jne reguler bayar kirim sudah senin jne reguler sangkut lagi jakarta,negatif
kirim kemarin nya hari sampai pakai layan baik baik,negatif
kirim lambat sekali lain hari sampai sudah hari situ saja,negatif
kirim nasib tidak jelas tanggal tv jne lampung nya tidak bisa kasih informasi jelas mana barang,negatif
kirim nomor resi kirim jakarta tanggal juni bogor sampai hari belum sampai ya status jne jakarta,negatif
kirim nya lama benar sudah jne tanggal sampai belum sampai aduh,negatif
kirim pagi jam kurang sampai jam malam barang belum gerak ongkos saja lipat loh rugi saja reguler sortir,negatif
kirim pakai paket terima,negatif
kirim paket anteraja cepat sicepat kali paket kirim lama masalah,negatif
kirim paket jakarta kamis belum sampai loh resi pesan langsung,negatif
kirim paket kendal sudah hari sampai jne malang tidak antar sampai jne lama payah cek resi,negatif
kirim paket lama kak nama ai cepat,negatif
kirim paket lampung pakai jne tanggal sampai hari belum sampai belum gerak,negatif
kirim paket pakai jne buat batin lama banget sumpah,negatif
kirim paket pakai jne lagi lama tidak gerak jakarta melulu,negatif
kirim paket pakai suruh tunggu sampai wib sampai tidak sampai barang tidak penting tidak pakai layan yakin tidak sampai ya,negatif
kirim sicepat minggu jelek banget astaga,negatif
kirim sudah lambat tunggu lagi gila kali,negatif
kirim surabaya jne hari tidak sampai kecewa,negatif
kirim surabaya mau hari belum sampai sampai gila,negatif
kirim tidak aman paket paket bobol kurir tidak pusat bintang,negatif
kirim tidak kabar layan buruk email tidak telepon kantor pusat usaha harga,negatif
komplain jne paket kirim jakarta manado makan tikus gudang jne sudah hari tidak kembang balas mohon tunggu ulur waktu proses ya,negatif
komplain kali barang kirim tidak sampai rumah lacak sudah hari sampai kota tuju baru tidak kabar hari komplain lagi eh paket hilang coba tidak komplain lagi tahu paket hilang,negatif
komplain lambat sekali,negatif
komplain mana ya sicepat paket belum sampai tolong informasi,negatif
komplain nomor whatsapp mesin balas tidak balas mohon perhati manajemen,negatif
komplain pesan langsung tidak respons sekali,negatif
komplain urus tidak sih suruh pesan langsung sudah pesan langsung tidak tanggap barang sudah mau minggu,negatif
korban maling paket nya,negatif
kurang baru pegawai mana tidak baru pesan tanggal juni kurir tidak baru payah pakai jne,negatif
kurang paham tidak pakai jne saja masalah,negatif
kurang sekali ekspedisi anteraja lambat sekali,negatif
kurang sicepat tidak bisa bayar tempat bawa paket kurang jnt lambat kurir sering ganti,negatif
kurir anteraja memang suka sekali terima paket nya isu bohong sendiri,negatif
kurir anteraja respons lambat banget tidak kurir lain,negatif
kurir anteraja si sudah hari ambil an paket tidak ambil ambil astaga kasihan beli tunggu lama dulu ambil tidak ambil sampai hari lebih mana kurir ketus banget lain kali ganti saja kali ya hilang hormat,negatif
kurir batal ambil ya maksud ya lapor pesan langsung tidak tanggap,negatif
kurir jelek kurir rekomendasi tokopedia labil pindah pindah merek anteraja sicepat tambah lagi kirim lama banget,negatif
kurir jne area tidak paham lokasi kerja sistem tulis alamat tidak lengkap tanggung jawab mesan jual kirim indonesia jelas tulis kirim informasi,negatif
kurir lihat sop usaha tidak laku orang rombak khusus orang tidak sop,negatif
kurir mana sudah tidak ambil hari,negatif
kurir sejarah bang,negatif
kurir si calon kurir latih dulu tidak si pas kuring tidak salah tahu benar sop kerja kasih tidak biar bisa paket,negatif
kurir sicepat jelek sudah sampai tidak kirim rumah,negatif
kurir sicepat memang barang ya tidak panggil ketuk pintu pagar barang sering sesat parah,negatif
kurir tidak bisa temu alamat alamat sudah jelas kasih baik baik si kurir respons nya kasar ujung paket urus saja administrator,negatif
kurir tidak cepat nama beli barang tanggal mei pertama pakai jne register surabaya pakai sicepat baik hari jakarta barat eh surabaya sudah sampai lebih dulu,negatif
kurir tik orang baru rusak salah tanya dehidrasi paket sudah jelas alamat sampai kali sesat rumah orang lain nomor rumah beda nama jalan rt,negatif
kurir tik tidak ya siang belum sampai prioritas,negatif
lacak jne memang ons,negatif
lacak nomor sudah administrator jne bandung kirim data lengkap alamat tuju pintu gerbang titik lokasi google map tidak tanggap,negatif
laden kah sampai tidak bisa cek paket,negatif
lagi bicara jaka sembung bawa golok,negatif
lagi kakak tidak kirim langsung alamat tuju kemarin mau kirim sampai belum kirim sudah alamat nomor telepon tolong kakak kualitas lebih tingkat lagi tidak kecewa beli mohon kakak,negatif
lagi kerja benar saja kurir administrator tidak konfirmasi main saja,negatif
lagi komplain sicepat ambil barang karyawan musuh kirim tidak loh tidak acuh saja tertawa akhir ya memang niat usir kirim kali ya biar jangan kirim pakai sicepat biar tidak usah kerja,negatif
lagi lagi kurir ekspedisi tidak tanggung jawab tindak lanjut oknum kurir,negatif
lagi lagi lagi ya kapok sudah pakai saja tidak deh bayar ongkos kirim tidak lambat,negatif
lagi lagi layan sicepat buat kesal,negatif
lagi selang waktu paket bawa kurir sampai paket kembali terima tidak rumah menit kurir pakai awan mau mangkir tanggung jawab ya,negatif
lagi sudah emak kompleks nyinyir gadis tetangga sudah paket tanggal sudah denpasar benar ya moga jne,negatif
lain balas twitnya tidak ya paket belum sampai sampai lewat estimasi,negatif
lain kali jangan sampai pakai anteraja pilih gratis ongkos kirim anteraja lebih baik batal indonesia sambat sicepat loh bagus lebih baik shopee hindar anteraja,negatif
laku usaha bisnis dunia kpop rugi barang barang nyata rusak hilang datang barang tidak lengkap ambil,negatif
lama banget anjing kota saja makan waktu hari buat antar alamat sesal pilih anteraja,negatif
lama banget dekat administrator,negatif
lama banget ih lanjur batal sistem sudah kemarin,negatif
lama banget jakarta belitung hari sampai sudah hari,negatif
lama banget paket administrator lanjur busuk deh makan pesan langsung tunggu tidak pesan langsung jne muncul resi,negatif
lama banget tanggal desember tanggal desember baru keluar jakarta tidak rekomendasi,negatif
lama banget ya allah,negatif
lama benar motor sudah rewel barang tidak jelas datang nya hari barang tidak gerak gudang jakarta timur,negatif
lama buat kesal puasa astaga,negatif
lama jelek banget performa antar jakarta saja hari tidak sampai tunda masalah operasional masalah tolong baik kualitas layan,negatif
lama jne mah gojek saja,negatif
lama kali administrator astaga resi cek barang sudah kirim belum,negatif
lama kali ku rasa sicepat rasa lambat baru kirim paket jakarta kirim makan sudah basi makan administrator,negatif
lama saja sicepat jnt sudah beres lebaran,negatif
lama sampai kabupaten paket mau jakarta aneh,negatif
lama sekali kak arab,negatif
lama sekali tunggu abang jne tidak datang,negatif
lama tahi,negatif
lama tanggal januari jawab suruh tunggu melulu,negatif
lambat administrator sudah hari pesan langsung terima kasih,negatif
lambat banget administrator,negatif
lambat banget sih sistem mah lanjur belanda serang lagi indonesia lambat,negatif
lambat lambat lambat keong,negatif
lambat respons ya sudah coba hubung lewat whatsapp lambat respons butuh cepat barang,negatif
lambat ya usaha cari kontak jne baru jalan susah ya baru sampai cari tahu sendiri hari,negatif
langgan peduli mu jelek sudah hari kontak langgan peduli mu mau whatsapp telepon hasil lempar ujung mau orang tahu betapa langgan peduli mu solusi administrator tidak lempar lagi,negatif
langsung stres lupa jasa kirim shopee express sicepat jnt jne,negatif
lapor bisa administrator nya,negatif
lapor paket hilang belum ganti administrator layan langgan sicepat sudah ganti nila harga beli barang beli tidak terima tolong tidak tahu sicepat mana bohong tidak mau tanggung jawab,negatif
lawak memang jne payah sesal pakai jne,negatif
layan anteraja kurang sekali sudah langgan layan panggil whatsapp lacak aplikasi jelek sekali respons lambat status barang tidak sesuai,negatif
layan baik langgan tidak mau nilai rendah banyak loh keluh tidak balas sekali tolong lagi butuh paket lagi buru buru lambat sudah hari loh hari,negatif
layan buruk sekali tolong baik,negatif
layan jasa ekspedisi tidak amanah tidak tanggung jawab,negatif
layan jelek,negatif
layan jne kecewa,negatif
layan jnt lagi sekali paket macet melulu kemarin sampai hari kemarin macet tidak jalan paket sicepat anteraja bisa hari sampai,negatif
layan kecewa paket macet sudah hari pakai anteraja,negatif
layan kurang puas langgan kait proses kirim kecewa abang aduh gusti sabar,negatif
layan langgan bayar sering gagal tiada mesti evaluasi internal sistem bayar sering gagal bukti transaksi lain tidak masalah sungguh repot langgan,negatif
layan langgan sicepat tidak whatsapp line twitter suka jawab tidak sambung tanya sih,negatif
layan malas pakai jasa pos indonesia laku,negatif
layan sicepat banget ya ya jual ikut si kurir buat kurir tentu alas tidak waktu sudah begitu layan banget,negatif
layan sicepat benar bobrok layan langgan sampai nya,negatif
lazada ninja express ya lama sekali sampai bisa minggu lebih,negatif
lazada pakai ninja express super lambat,negatif
lebih bagus jnt ya sumpah jne tidak banget kecewa kali,negatif
lebih baik barang sendiri pesan orang tidak sampai komplain suruh buat cepat buat sampai barang,negatif
lebih baik ekspedisi jnt saja kakak jne dulu begitu lama sekali,negatif
lebih baik ganti nama saja jne biar bisa lebih bijak pilih ekspedisi takut saja dukung kelompok hasut,negatif
lebih baik pilih ekspedisi lain dulu deh mau belanja daring kemarin paket langgan sudah hari tidak komplain lama mau antar tempat drop jauh rumah sampai akhir langgan batal sudah jadi kali,negatif
lebih baik sudah kirim bisa cek jne nya tanggal sampai emas komplain tidak ubah hari akhir garansi tidak kirim batal tunggu batal doang,negatif
lebih baik tanggal april tidak sampai sesak banget tidak deh pakai anteraja bisa pas mau bayar lihat detail situ kurir anteraja sicepat,negatif
lebih baik telepon saja whatsapp tidak balas,negatif
lebih baik tidak pakai lagi sih takut jadi lagi,negatif
lebih baik wig orang start paket tidak sampai sampai kirim jakarta selatan buat tangsel,negatif
lebih cocok pakai nama lambat sih estimasi maksimal tanggal eh tanggal belum informasi lain hari sudah sampai hari kabar saja tidak ekspedisi lindas lain ulah karyawannya sendiri,negatif
lebih parah anjing benar benar sudah,negatif
lebih parah sicepat jakarta minggu,negatif
lelah banget alias lambat,negatif
lelah banget jne hari sudah kota tidak ambil kurir,negatif
lelah banget jujur anteraja nama ganti saja,negatif
lelah jelas haram pakai jne lagi sumpah haram bayar paket sudah masuk jne tidak boleh ambil lagi ambil uang ongkos ku lagi mau ambil paket,negatif
lelah sicepat buat emosi melulu,negatif
lemes banget baca komplain orang orang jne memang lambat dulu pakai tidak loh masak surabaya malang saja hari aduh lebih baik kemarin bayar mahal tidak pakai gratis ongkos kirim toko hijau potong ribu buat darah,negatif
lempar sih mau konfirmasi tidak suruh pusat belanja pusat belanja,negatif
lihat lini banyak rusak pakai jne takut,negatif
lion jelek banget layan astaga,negatif
loh memang tidak komplain belum datang paket hari minggu tanya whatsapp tanya alamat lengkap aku sicepat memang begitu alamat paket tidak salah memang belum antar mesti tanya ulang,negatif
lupa ganti ekspedisi pakai anteraja sesak,negatif
maaf hari tidak pakai lagi kirim hari esok hari jual ulang tidak boleh pakai jne,negatif
maaf kecewa sudah begitu antar akhir sampai pesan pribadi sudah tulis jarak sicepat rumah hai meter kadang gagal kirim kirim esok sampai malam sekali begitu pesan pribadi,negatif
maaf not maaf layan tik kecewa ekspedisi lain oke saja layan balik lagi mau beli barang jangan pakai tik ya,negatif
macet bekas kirim tanggal sampai belum sampai,negatif
macet cimahi sampai hari aduh lanjut paket nya sampai kah,negatif
macet hubung surabaya tanggal butuh banget barang,negatif
macet sudah hari cimahi sudah tanggal,negatif
mah kapok pakai lama sekali tidak aman ku doa moga jne mau tanggung jawab ya kak,negatif
mah kecewa banget tidak sekali kali jne paket kotak nya datang sudah sobek lama sekali sampai nya buat kecewa tidak lagi deh pakai jne terus,negatif
mah mah jnt sicepat burak lama,negatif
main bang gosend hindar dulu,negatif
makan lebih aman kirim pakai kak jangan harap banyak pakai jne,negatif
maksud ya gagal kirim pas sudah sampai tangan kurir kemarin sudah tunda gagal kirim masalah operasional tunda lagi,negatif
maksud ya paket tidak sampai,negatif
malam status sudah bawa lokasi sampai tidak sampai anjing,negatif
malas jne ah layan nya jelek,negatif
malas sudah bawa kurir jam jam tutup toko tidak datang memang paket nya register hari sudah bawa lagi bawa mesti tunda sampai besok lagi si jam loh memang hujan sudah redah jam an aduh,negatif
maling kedok jasa kirim grup jual shopee banyak hilang barang barang rusak bukti tertawa paket hari tidak sampai jabodetabek parah benar maling kedok jasa kirim,negatif
mana belum telepon proses tidak jelas jangan gantung paket mau ganti saja,negatif
mana bisa percaya tidak tindak oknum orang pasti tidak percaya,negatif
mana pakai jne loh tolong segera,negatif
mana pakai layan baik hari langsung sampai bukti belum sampai tangerang tangerang loh mohon bantu coba,negatif
mana paket belum kirim tinggal antar kurir doang lambat banget layan,negatif
mantap paket hilang,negatif
mantap tidak barang gawat ya mana jual tidak mau tanggung jawab komplain tidak maju telepon sampai saja sudah aju dana eh tidak mah kena sial,negatif
marah,negatif
marah banget si sudah minggu paket belum datang jelas administrator,negatif
masalah berapa harga makan nya rasa makan sudah lanjur rusak sudah lama masalah jawab nya nya milik hilang tidak kabar nya tidak tanggung jawab sekali jne,negatif
masalah nomor resi belum ambil status nya paket belum ambil kurir tidak datang ambil paket nya parah banget,negatif
masalah paket pakai sicepat halu,negatif
masalah sicepat kait paket kosong tidak langsung segera ganti keren banget toko tidak lagi aktif kirim jne tidak banget layan,negatif
mau ambil gerai saja,negatif
mau bilang rugi jebak tanda kutip paksa pilih ekspedisi ekspedisi sopan tanya lewat pesan langsung usaha lain,negatif
mau bilang tidak benar benar mau tindak lanjut barang sudah sampai belum beli tidak akhir tidak respons tahu detail saja lacak kira kira aneh tidak,negatif
mau cek resi tidak sah administrator,negatif
mau cepat respons jne sudah minggu paket tidak mau sampai hilang,negatif
mau emas buat menang tidak tidak bisa bungkus gelembung lama sekali gara gara sicepat ya allah murka sekali,negatif
mau gosend mahal jnt lambat,negatif
mau jne saja bang,negatif
mau lebaran baju buat lebaran belum sampai,negatif
mau marah banget sicepat allah,negatif
mau nominal belanja jangan pakai ya lihat kurir nya sicepat oke super sekali tidak baru tidak jelas semarang gudang jakarta hari tidak sampai tidak baru resi nya tanya kirim,negatif
mau pakai pasar layan jelek bogor denpasar bisa lebih hari,negatif
mau pindah sicepat saja jnt sebal banget,negatif
mau saja sat kesal sekali kemarin paket lambat datang pakai ekspedisi kapok kapok asli,negatif
mau sih jauh gosend nya mahal,negatif
mau tanya ambil sendiri kantor pos mana mohon alamat kantor pos nya kecewa sekali hari paket tidak sampai tidak pakai sicepat jnt jne kapok pakai pos resi pesan masuk tolong baca,negatif
mau tanya deh ekspedisi jne libur kah paket ku malam tahun baru tidak gerak jarak kota kirim terima jam,negatif
mau tanya memang kurir antar barang barang lempar rumah tidak tahu kurir kaget dengar suara benda lempar rumah paket keluar kurir langsung tancap gas,negatif
mau tanya paket nomor tidak gerak hari senin,negatif
mau tanya paket sudah sampai kota tuju tidak kirim rumah telepon layan langgan tidak bisa ampun sesal jne,negatif
mau tanya resi kirim resi manual resi manual resi resmi jne tanya buat lacak tolak olah resi ada tidak resmi jne terbit resi,negatif
memang begitu kak makan hati ekspedisi barang saja sudah tukar kirim lagi sesat barang orang kali kirim pasti tukar tidak tidak tukar heran pusat belanja saja pakai ekspedisi,negatif
memang bin jnt kadang kesal pakai sicepat saja lanjut,negatif
memang bulan sicepat sudah tidak dulu sudah kali coba sicepat tidak pengaruh bulan gaji tidak proses lama,negatif
memang cepat lambat perhati lebih perhati ekspedisi pesan ekspedisi lain sudah terima sicepat cocok lambat,negatif
memang emosi banget kak gila waktu hubung shopee saja kak waktu shopee lebih sicepat ya bulan,negatif
memang halu ekspedisi sayang gratis ongkos kirim tokopedia tidak bisa pilih ekspedisi barang sudah sampai bogor mau kirim lagi jakarta halu sumpah,negatif
memang jelek banget jne,negatif
memang jne begitu beli sepatu saja sudah sobek kertas buat bungkus paket sudah sampai lama tulis sudah terima dulu orang rumah tidak terima eh pas sampai emas nya sudah sobek,negatif
memang jne omong kosong kena bintang beli paket lama tidak baru buat orang kecewa provinsi parah,negatif
memang juara gagal ambil alas paket belum konfirmasi kirim tidak kurir datang,negatif
memang kakak mana rumah diri diri sih kak banyak keluh sicepat memang benar benar macet,negatif
memang kurir tidak jelas ya kurir jne sudah jelas tulis alamat suruh ambil sendiri alas alamat tidak lengkap kurir lain tidak,negatif
memang lama kali pakai sicepat hari pakai shopee express minggu lebih mau,negatif
memang lama tahu sebal enak sicepat,negatif
memang masalah banget deh jakarta timur paket tanggal macet,negatif
memang masalah sih antar saja kirim paket malang sampai minggu lebih sudah begitu putar dulu diri surabaya baru malang,negatif
memang rusak sicepat yogyakarta sleman hari belum sampai,negatif
memang si kemarin paket pakai jne penyok shopee lazada lazada rapuh sekali begitu untung si tidak,negatif
memang sistem ambil buat lama kakak pertama kali coba jnt hari tiga baru ambil bolak balik telepon langgan kesal banget kapok gosend saja dekat rumah,negatif
memang sudah sop lempar paket kirim ketuk pintu paket sampai rusak situ mau ganti mau lagak bodoh,negatif
memang tahi tidak jera nya tidak gaji nya sampai paket orang mau nya,negatif
memang tidak cocok jne kali pakai jasa tidak puas,negatif
memang ya jne lambat sekali ribet malas lebih sering pakai jnt bayar tempat biar,negatif
menang sih banget memang tidak mau tanggung jawab aduh jne tidak ya,negatif
pesan barang datang datang sudah bolong bungkus nya ya sicepat doa saja deh moga selamat rezeki nya lancar biar tidak suka ambil orang lagi,negatif
pesan terima lambat hari agustus sabtu sudah tanya ninja express surabaya hari tanya lagi ninja express posisi barang surabaya mau pakai kerja,negatif
migrain ibu lama urus masalah paket doang,negatif
minggu kemarin paket tidak gerak cimahi sampai hari hari baru kirim paket parah memang,negatif
minggu tidak kabar mana paket,negatif
misi administrator tolong paket sicepat halu nomor resi sudah tanggal situ situ saja tidak gerak butuh banget tanggal,negatif
moga jangan sampai pakai kurir lagi,negatif
moga jne trucking tidak buat kapok anteraja nya pas lebaran,negatif
moga nya baik saja baru dengar lumayan banyak hilang pas pakai kirim sicepat,negatif
mohon administrator akses sicepat kait segera tindak lanjut barang penting jangan sampai ulang lagi kak sudah kali pakai sicepat lambat tidak sesuai nama parah,negatif
mohon bantu cek pesan langsung ya layan langgan whatsapp tidak solusional kurir tidak solusional pesan langsung tidak respons tolong ya,negatif
mohon baru resi sampai mana kemarin tidak baru apa aduh,negatif
mohon cek paket sudah hari lacak status tidak ubah,negatif
mohon cek pesan langsung facebook langgan peduli jne layan lambat,negatif
mohon cek pesan langsung kirim sudah minggu tidak jalan payah jne,negatif
mohon informasi resi paket tidak sampai,negatif
mohon informasi resi status kirim belum baru tanggal mohon status baru paket mana,negatif
mohon jawab jne barang terima pecah terima kasih,negatif
mohon kirim paket drop sicepat tanggal juni sampai macet tidak jalan cek komplain lain kait kendala kirim tanggal juni rusak cek pesan langsung administrator,negatif
mohon selesai baik estimasi saja hari tangerang kurang performa,negatif
muak kali jnt ekspedisi tidak jelas,negatif
murah hari sampai mesti hubung terima aktif pasif parah sih tidak rekomendasi lagi jasa,negatif
musnah saja jne kurir sesat telepon tidak bisa lagi,negatif
naik pitam ya poster susah dapat mesti benar tunggu nya lama suruh abang jne nya korea cepat kesal banget,negatif
nama doang sicepat jne,negatif
nama doang sicepat sampai lambat,negatif
nama ninja tidak cepat naik jakarta solo hari doang gila,negatif
nama saja cepat kirim sudah hari bekas jakarta doang,negatif
nama saja mau sampai kapok pakai saja,negatif
nama saja sicepat kurir lama,negatif
nama sicepat tidak cepat lelah deh tunggu paket tidak datang,negatif
nasib buruk paket kirim jne azab diam diam co,negatif
nasib jalan beli sesat mana ya kurir,negatif
nasib sicepat lambat ya,negatif
nasib tanggal tidak orang lain kirim batam sudah sampai loh pakai jnt hari jne batam sih suram banget kapok,negatif
nasib ya tanggal tidak gerak,negatif
niat buat layan ambil tidak sih orang tunggu loh sampai pulang kantor lebih cepat tidak bisa tidak usah buat layan ambil,negatif
ninja express burik alias sial sesal hai,negatif
ninja express lama sekali sudah malam tidak gerak,negatif
ninja express tidak express,negatif
ninja express tidak express berat nama,negatif
nomor aktif kurir nomor mana tinggal telepon kurir selesai urus masalah saja tele sampai hari habis waktu,negatif
nomor kurir jne kalah jnt kurir jne tidak tanggung jawab konsumen jne rugi hilang konsumen kurir pecat saja ganti profesional,negatif
nomor resi hari jakarta tidak sampai sampai kurir jalan kaki naik deh,negatif
nomor resi kak barang saja tidak ambil kurir,negatif
nomor resi kantor waru masalah paket tidak sampai sampai status sudah kirim kurir kantor waru banyak keluh mohon baik administrator lebih paket urus sudah lama begitu,negatif
nomor resi lama sekali sudah tanggal ya lambat sekali kerja,negatif
nomor resi minggu barang tidak sampai coba telusur kirim pakai trucking bayar reguler mahal kirim pakai trucking kapok sudah pakai jne jne moga langgan tidak kabur layan,negatif
